[
 {
  "domain": "pcmag.com",
  "vertical": "consumer_electronics",
  "probes_cited_in_vertical": 60,
  "vertical_probes_total": 80,
  "share": 0.75,
  "stability": "both_runs",
  "probe_ids": [
   "ce-02-r1",
   "ce-02-r2",
   "ce-03-r1",
   "ce-03-r2",
   "ce-05-r1",
   "ce-05-r2",
   "ce-06-r1",
   "ce-06-r2",
   "ce-07-r1",
   "ce-07-r2",
   "ce-08-r1",
   "ce-08-r2",
   "ce-09-r1",
   "ce-09-r2",
   "ce-10-r1",
   "ce-10-r2",
   "ce-11-r1",
   "ce-11-r2",
   "ce-12-r1",
   "ce-12-r2",
   "ce-13-r1",
   "ce-13-r2",
   "ce-15-r1",
   "ce-15-r2",
   "ce-16-r1",
   "ce-16-r2",
   "ce-17-r1",
   "ce-17-r2",
   "ce-18-r1",
   "ce-18-r2",
   "ce-19-r1",
   "ce-19-r2",
   "ce-20-r1",
   "ce-20-r2",
   "ce-22-r1",
   "ce-22-r2",
   "ce-23-r1",
   "ce-23-r2",
   "ce-24-r1",
   "ce-24-r2",
   "ce-25-r1",
   "ce-25-r2",
   "ce-27-r1",
   "ce-27-r2",
   "ce-28-r1",
   "ce-28-r2",
   "ce-32-r1",
   "ce-32-r2",
   "ce-33-r1",
   "ce-33-r2",
   "ce-36-r1",
   "ce-36-r2",
   "ce-37-r1",
   "ce-37-r2",
   "ce-38-r1",
   "ce-38-r2",
   "ce-39-r1",
   "ce-39-r2",
   "ce-40-r1",
   "ce-40-r2"
  ],
  "s_citation_share": 1.0
 },
 {
  "domain": "autoexpress.co.uk",
  "vertical": "automotive",
  "probes_cited_in_vertical": 54,
  "vertical_probes_total": 80,
  "share": 0.675,
  "stability": "both_runs",
  "probe_ids": [
   "auto-01-r1",
   "auto-01-r2",
   "auto-02-r1",
   "auto-02-r2",
   "auto-03-r1",
   "auto-03-r2",
   "auto-05-r1",
   "auto-05-r2",
   "auto-08-r1",
   "auto-08-r2",
   "auto-09-r1",
   "auto-09-r2",
   "auto-11-r1",
   "auto-11-r2",
   "auto-12-r1",
   "auto-12-r2",
   "auto-13-r1",
   "auto-13-r2",
   "auto-14-r1",
   "auto-14-r2",
   "auto-15-r1",
   "auto-15-r2",
   "auto-16-r1",
   "auto-16-r2",
   "auto-18-r1",
   "auto-18-r2",
   "auto-19-r1",
   "auto-19-r2",
   "auto-21-r1",
   "auto-21-r2",
   "auto-22-r1",
   "auto-22-r2",
   "auto-23-r1",
   "auto-23-r2",
   "auto-26-r1",
   "auto-26-r2",
   "auto-27-r1",
   "auto-27-r2",
   "auto-28-r1",
   "auto-28-r2",
   "auto-30-r1",
   "auto-30-r2",
   "auto-32-r1",
   "auto-32-r2",
   "auto-33-r1",
   "auto-33-r2",
   "auto-36-r1",
   "auto-36-r2",
   "auto-38-r1",
   "auto-38-r2",
   "auto-39-r1",
   "auto-39-r2",
   "auto-40-r1",
   "auto-40-r2"
  ],
  "s_citation_share": 1.0
 },
 {
  "domain": "whatcar.com",
  "vertical": "automotive",
  "probes_cited_in_vertical": 46,
  "vertical_probes_total": 80,
  "share": 0.575,
  "stability": "both_runs",
  "probe_ids": [
   "auto-01-r1",
   "auto-01-r2",
   "auto-02-r1",
   "auto-02-r2",
   "auto-03-r1",
   "auto-03-r2",
   "auto-06-r1",
   "auto-06-r2",
   "auto-07-r1",
   "auto-07-r2",
   "auto-08-r1",
   "auto-08-r2",
   "auto-09-r1",
   "auto-09-r2",
   "auto-12-r1",
   "auto-12-r2",
   "auto-13-r1",
   "auto-13-r2",
   "auto-14-r1",
   "auto-14-r2",
   "auto-16-r1",
   "auto-16-r2",
   "auto-18-r1",
   "auto-18-r2",
   "auto-20-r1",
   "auto-20-r2",
   "auto-21-r1",
   "auto-21-r2",
   "auto-23-r1",
   "auto-23-r2",
   "auto-24-r1",
   "auto-24-r2",
   "auto-26-r1",
   "auto-26-r2",
   "auto-32-r1",
   "auto-32-r2",
   "auto-34-r1",
   "auto-34-r2",
   "auto-35-r1",
   "auto-35-r2",
   "auto-36-r1",
   "auto-36-r2",
   "auto-37-r1",
   "auto-37-r2",
   "auto-38-r1",
   "auto-38-r2"
  ],
  "s_citation_share": 1.0
 },
 {
  "domain": "drive.co.uk",
  "vertical": "automotive",
  "probes_cited_in_vertical": 44,
  "vertical_probes_total": 80,
  "share": 0.55,
  "stability": "both_runs",
  "probe_ids": [
   "auto-02-r1",
   "auto-02-r2",
   "auto-05-r1",
   "auto-05-r2",
   "auto-07-r1",
   "auto-07-r2",
   "auto-09-r1",
   "auto-09-r2",
   "auto-11-r1",
   "auto-11-r2",
   "auto-12-r1",
   "auto-12-r2",
   "auto-13-r1",
   "auto-13-r2",
   "auto-15-r1",
   "auto-15-r2",
   "auto-18-r1",
   "auto-18-r2",
   "auto-19-r1",
   "auto-19-r2",
   "auto-23-r1",
   "auto-23-r2",
   "auto-24-r1",
   "auto-24-r2",
   "auto-25-r1",
   "auto-25-r2",
   "auto-26-r1",
   "auto-26-r2",
   "auto-27-r1",
   "auto-27-r2",
   "auto-28-r1",
   "auto-28-r2",
   "auto-29-r1",
   "auto-29-r2",
   "auto-30-r1",
   "auto-30-r2",
   "auto-33-r1",
   "auto-33-r2",
   "auto-36-r1",
   "auto-36-r2",
   "auto-38-r1",
   "auto-38-r2",
   "auto-39-r1",
   "auto-39-r2"
  ],
  "s_citation_share": 1.0
 },
 {
  "domain": "runnersworld.com",
  "vertical": "sportswear",
  "probes_cited_in_vertical": 38,
  "vertical_probes_total": 80,
  "share": 0.475,
  "stability": "both_runs",
  "probe_ids": [
   "ce-29-r1",
   "ce-29-r2",
   "sport-01-r1",
   "sport-01-r2",
   "sport-02-r1",
   "sport-02-r2",
   "sport-03-r1",
   "sport-03-r2",
   "sport-06-r1",
   "sport-06-r2",
   "sport-07-r1",
   "sport-07-r2",
   "sport-09-r1",
   "sport-09-r2",
   "sport-10-r1",
   "sport-10-r2",
   "sport-11-r1",
   "sport-11-r2",
   "sport-14-r1",
   "sport-14-r2",
   "sport-15-r1",
   "sport-15-r2",
   "sport-18-r1",
   "sport-18-r2",
   "sport-19-r1",
   "sport-19-r2",
   "sport-25-r1",
   "sport-25-r2",
   "sport-26-r1",
   "sport-26-r2",
   "sport-27-r1",
   "sport-27-r2",
   "sport-29-r1",
   "sport-29-r2",
   "sport-36-r1",
   "sport-36-r2",
   "sport-37-r1",
   "sport-37-r2",
   "sport-40-r1",
   "sport-40-r2"
  ],
  "s_citation_share": 1.0
 },
 {
  "domain": "nytimes.com",
  "vertical": "consumer_electronics",
  "probes_cited_in_vertical": 32,
  "vertical_probes_total": 80,
  "share": 0.4,
  "stability": "both_runs",
  "probe_ids": [
   "ce-01-r1",
   "ce-01-r2",
   "ce-03-r1",
   "ce-03-r2",
   "ce-06-r1",
   "ce-06-r2",
   "ce-10-r1",
   "ce-10-r2",
   "ce-11-r1",
   "ce-11-r2",
   "ce-14-r1",
   "ce-14-r2",
   "ce-15-r1",
   "ce-15-r2",
   "ce-17-r1",
   "ce-17-r2",
   "ce-18-r1",
   "ce-18-r2",
   "ce-21-r1",
   "ce-21-r2",
   "ce-26-r1",
   "ce-26-r2",
   "ce-27-r1",
   "ce-27-r2",
   "ce-28-r1",
   "ce-28-r2",
   "ce-33-r1",
   "ce-33-r2",
   "ce-36-r1",
   "ce-36-r2",
   "ce-40-r1",
   "ce-40-r2",
   "sport-19-r1",
   "sport-19-r2",
   "sport-35-r1",
   "sport-35-r2"
  ],
  "s_citation_share": 1.0
 },
 {
  "domain": "cnet.com",
  "vertical": "consumer_electronics",
  "probes_cited_in_vertical": 30,
  "vertical_probes_total": 80,
  "share": 0.375,
  "stability": "both_runs",
  "probe_ids": [
   "ce-01-r1",
   "ce-01-r2",
   "ce-03-r1",
   "ce-03-r2",
   "ce-08-r1",
   "ce-08-r2",
   "ce-10-r1",
   "ce-10-r2",
   "ce-11-r1",
   "ce-11-r2",
   "ce-15-r1",
   "ce-15-r2",
   "ce-25-r1",
   "ce-25-r2",
   "ce-27-r1",
   "ce-27-r2",
   "ce-30-r1",
   "ce-30-r2",
   "ce-32-r1",
   "ce-32-r2",
   "ce-33-r1",
   "ce-33-r2",
   "ce-35-r1",
   "ce-35-r2",
   "ce-36-r1",
   "ce-36-r2",
   "ce-38-r1",
   "ce-38-r2",
   "ce-40-r1",
   "ce-40-r2",
   "sport-17-r1",
   "sport-17-r2"
  ],
  "s_citation_share": 1.0
 },
 {
  "domain": "independent.co.uk",
  "vertical": "consumer_electronics",
  "probes_cited_in_vertical": 26,
  "vertical_probes_total": 80,
  "share": 0.325,
  "stability": "both_runs",
  "probe_ids": [
   "auto-03-r2",
   "auto-05-r1",
   "auto-05-r2",
   "auto-33-r1",
   "auto-33-r2",
   "auto-39-r1",
   "auto-39-r2",
   "ce-02-r1",
   "ce-02-r2",
   "ce-04-r1",
   "ce-04-r2",
   "ce-05-r1",
   "ce-05-r2",
   "ce-07-r1",
   "ce-07-r2",
   "ce-12-r1",
   "ce-12-r2",
   "ce-13-r1",
   "ce-13-r2",
   "ce-15-r1",
   "ce-15-r2",
   "ce-20-r1",
   "ce-20-r2",
   "ce-21-r1",
   "ce-21-r2",
   "ce-22-r1",
   "ce-22-r2",
   "ce-29-r1",
   "ce-29-r2",
   "ce-37-r1",
   "ce-37-r2",
   "ce-39-r1",
   "ce-39-r2",
   "sport-04-r1",
   "sport-04-r2",
   "sport-21-r1",
   "sport-21-r2",
   "sport-29-r1",
   "sport-29-r2",
   "sport-34-r1",
   "sport-34-r2",
   "sport-37-r1",
   "sport-37-r2"
  ],
  "s_citation_share": 1.0
 },
 {
  "domain": "rtings.com",
  "vertical": "consumer_electronics",
  "probes_cited_in_vertical": 26,
  "vertical_probes_total": 80,
  "share": 0.325,
  "stability": "both_runs",
  "probe_ids": [
   "ce-01-r1",
   "ce-01-r2",
   "ce-08-r1",
   "ce-08-r2",
   "ce-14-r1",
   "ce-14-r2",
   "ce-16-r1",
   "ce-16-r2",
   "ce-17-r1",
   "ce-17-r2",
   "ce-18-r1",
   "ce-18-r2",
   "ce-19-r1",
   "ce-19-r2",
   "ce-25-r1",
   "ce-25-r2",
   "ce-30-r1",
   "ce-30-r2",
   "ce-31-r1",
   "ce-31-r2",
   "ce-35-r1",
   "ce-35-r2",
   "ce-36-r1",
   "ce-36-r2",
   "ce-37-r1",
   "ce-37-r2",
   "sport-25-r1",
   "sport-25-r2",
   "sport-26-r1",
   "sport-26-r2",
   "sport-40-r1",
   "sport-40-r2"
  ],
  "s_citation_share": 1.0
 },
 {
  "domain": "runrepeat.com",
  "vertical": "sportswear",
  "probes_cited_in_vertical": 26,
  "vertical_probes_total": 80,
  "share": 0.325,
  "stability": "both_runs",
  "probe_ids": [
   "sport-01-r1",
   "sport-01-r2",
   "sport-02-r1",
   "sport-02-r2",
   "sport-04-r1",
   "sport-04-r2",
   "sport-10-r1",
   "sport-10-r2",
   "sport-11-r1",
   "sport-11-r2",
   "sport-12-r1",
   "sport-12-r2",
   "sport-13-r1",
   "sport-13-r2",
   "sport-16-r1",
   "sport-16-r2",
   "sport-17-r1",
   "sport-17-r2",
   "sport-25-r1",
   "sport-25-r2",
   "sport-26-r1",
   "sport-26-r2",
   "sport-30-r1",
   "sport-30-r2",
   "sport-40-r1",
   "sport-40-r2"
  ],
  "s_citation_share": 1.0
 },
 {
  "domain": "tomsguide.com",
  "vertical": "consumer_electronics",
  "probes_cited_in_vertical": 26,
  "vertical_probes_total": 80,
  "share": 0.325,
  "stability": "both_runs",
  "probe_ids": [
   "ce-06-r1",
   "ce-06-r2",
   "ce-11-r1",
   "ce-11-r2",
   "ce-14-r1",
   "ce-14-r2",
   "ce-15-r1",
   "ce-15-r2",
   "ce-16-r1",
   "ce-16-r2",
   "ce-17-r1",
   "ce-17-r2",
   "ce-18-r1",
   "ce-18-r2",
   "ce-25-r1",
   "ce-25-r2",
   "ce-27-r1",
   "ce-27-r2",
   "ce-28-r1",
   "ce-28-r2",
   "ce-32-r1",
   "ce-32-r2",
   "ce-36-r1",
   "ce-36-r2",
   "ce-40-r1",
   "ce-40-r2",
   "sport-02-r1",
   "sport-02-r2",
   "sport-03-r1",
   "sport-03-r2",
   "sport-16-r1",
   "sport-16-r2",
   "sport-25-r1",
   "sport-25-r2"
  ],
  "s_citation_share": 1.0
 },
 {
  "domain": "techradar.com",
  "vertical": "consumer_electronics",
  "probes_cited_in_vertical": 21,
  "vertical_probes_total": 80,
  "share": 0.2625,
  "stability": "both_runs",
  "probe_ids": [
   "ce-09-r1",